{
  "schemaVersion": 1,
  "meta": {
    "title": "Operations Review – Monthly Governance Dashboard",
    "period": "May 2026 (CW22)",
    "portfolioOwner": "TCS Operations Team",
    "confidentiality": "Confidential — Internal Use Only",
    "reportDate": "2026-05-29",
    "lastUpdated": "2026-05-29T16:30:00Z",
    "generatedAt": "2026-05-29T16:30:00Z"
  },
  "pulse": {
    "keyFlag": "Overall backlog reduced by 12% this period. SLA compliance sustained above 96% across all SAP modules. Three escalations resolved; CRM-ERP sync bridge fix deployed. PRB0012044 root cause identified — patch scheduled for CW23.",
    "generatedAt": "2026-05-29T16:30:00Z"
  },
  "global": {
    "sapTotal": 126,
    "sapTotalDelta": -7.7,
    "sapBacklog": 34,
    "sapBacklogDelta": -14.3,
    "sapSLAComposite": 96.2,
    "sapSLADelta": 1.3,
    "nsTotal": 42,
    "nsTotalDelta": -10.0,
    "nsBacklog": 11,
    "nsBacklogDelta": -20.0,
    "nsSLAComposite": 97.8,
    "nsSLADelta": 1.1,
    "domains": {
      "SAP": { "total": 126, "backlog": 34, "slaComposite": 96.2, "priorTotal": 136 },
      "NonERP": { "total": 42, "backlog": 11, "slaComposite": 97.8, "priorTotal": 46 }
    }
  },
  "months": ["Dec", "Jan", "Feb", "Mar", "Apr", "May"],
  "monthsFull": ["2025-12", "2026-01", "2026-02", "2026-03", "2026-04", "2026-05"],
  "modules": [
    {
      "id": "crm",
      "name": "CRM",
      "domain": "SAP",
      "baseline": 55,
      "slaThreshold": { "green": 95, "amber": 90, "invert": true },
      "fte": 8,
      "total": 10,
      "inc": 6,
      "sr": 4,
      "resolved": 9,
      "netFlow": 1,
      "openCount": 3,
      "respSla": 93.8,
      "resolSla": 96.7,
      "mttr": 18.4,
      "reopenRate": 8.3,
      "firstFixRate": 91.7,
      "breachCount": 1,
      "nearMissCount": 2,
      "escalationRate": 4.2,
      "automation": 0,
      "mom": [14, 13, 12, 11, 11, 10],
      "incMom": [8, 7, 7, 6, 6, 6],
      "srMom": [6, 6, 5, 5, 5, 4],
      "resolvedMom": [12, 11, 11, 10, 10, 9],
      "netFlowMom": [2, 2, 1, 1, 1, 1],
      "backlogMom": [6, 5, 5, 4, 4, 3],
      "respSlaMom": [95.0, 94.2, 93.6, 94.1, 93.5, 93.8],
      "resolSlaMom": [97.5, 96.8, 97.1, 96.3, 97.0, 96.7],
      "priority": [25.0, 35.0, 30.0, 10.0],
      "age": [45.0, 30.0, 15.0, 10.0],
      "priorityMeta": [
        { "label": "P1/P2", "color": "red", "pct": 25.0 },
        { "label": "P3", "color": "amber", "pct": 35.0 },
        { "label": "P4", "color": "blue", "pct": 30.0 },
        { "label": "Unprioritised", "color": "muted", "pct": 10.0 }
      ],
      "ageMeta": [
        { "label": "0-3 wk", "color": "green", "pct": 45.0 },
        { "label": "3-6 wk", "color": "amber", "pct": 30.0 },
        { "label": "6-10 wk", "color": "purple", "pct": 15.0 },
        { "label": ">10 wk", "color": "red", "pct": 10.0 }
      ],
      "notes": [
        "- Duplicate order sync issue (PRB0012044) causing elevated ticket counts. RCA in progress.",
        "- One P2 incident (INC0094388) breached SLA over weekend — escalation logged."
      ]
    },
    {
      "id": "scm",
      "name": "SCM",
      "domain": "SAP",
      "baseline": 30,
      "fte": 5,
      "total": 6,
      "inc": 3,
      "sr": 3,
      "resolved": 6,
      "netFlow": 0,
      "openCount": 1,
      "respSla": 97.2,
      "resolSla": 98.5,
      "mttr": 12.1,
      "reopenRate": 4.0,
      "firstFixRate": 96.0,
      "breachCount": 0,
      "nearMissCount": 1,
      "escalationRate": 1.8,
      "automation": 0,
      "mom": [7, 8, 6, 7, 6, 6],
      "incMom": [4, 4, 3, 4, 3, 3],
      "srMom": [3, 4, 3, 3, 3, 3],
      "resolvedMom": [6, 7, 6, 7, 6, 6],
      "netFlowMom": [1, 1, 0, 0, 0, 0],
      "backlogMom": [2, 2, 1, 1, 1, 1],
      "respSlaMom": [96.5, 97.0, 96.8, 97.5, 97.0, 97.2],
      "resolSlaMom": [98.0, 98.2, 97.9, 98.6, 98.3, 98.5],
      "priority": [10.0, 30.0, 50.0, 10.0],
      "age": [60.0, 25.0, 10.0, 5.0],
      "priorityMeta": [
        { "label": "P1/P2", "color": "red", "pct": 10.0 },
        { "label": "P3", "color": "amber", "pct": 30.0 },
        { "label": "P4", "color": "blue", "pct": 50.0 },
        { "label": "Unprioritised", "color": "muted", "pct": 10.0 }
      ],
      "ageMeta": [
        { "label": "0-3 wk", "color": "green", "pct": 60.0 },
        { "label": "3-6 wk", "color": "amber", "pct": 25.0 },
        { "label": "6-10 wk", "color": "purple", "pct": 10.0 },
        { "label": ">10 wk", "color": "red", "pct": 5.0 }
      ],
      "notes": []
    },
    {
      "id": "authOekg",
      "name": "Auth OEKG",
      "domain": "SAP",
      "baseline": 20,
      "fte": 4,
      "total": 4,
      "inc": 2,
      "sr": 2,
      "resolved": 4,
      "netFlow": 0,
      "openCount": 1,
      "respSla": 99.0,
      "resolSla": 99.2,
      "mttr": 8.5,
      "reopenRate": 2.5,
      "firstFixRate": 97.5,
      "breachCount": 0,
      "nearMissCount": 0,
      "escalationRate": 0.0,
      "automation": 0,
      "mom": [5, 5, 4, 4, 4, 4],
      "incMom": [3, 2, 2, 2, 2, 2],
      "srMom": [2, 3, 2, 2, 2, 2],
      "resolvedMom": [5, 4, 4, 4, 4, 4],
      "netFlowMom": [0, 1, 0, 0, 0, 0],
      "backlogMom": [1, 2, 1, 1, 1, 1],
      "respSlaMom": [98.5, 99.0, 98.8, 99.2, 99.0, 99.0],
      "resolSlaMom": [99.0, 99.1, 99.0, 99.3, 99.2, 99.2],
      "priority": [5.0, 25.0, 55.0, 15.0],
      "age": [70.0, 20.0, 10.0, 0.0],
      "priorityMeta": [
        { "label": "P1/P2", "color": "red", "pct": 5.0 },
        { "label": "P3", "color": "amber", "pct": 25.0 },
        { "label": "P4", "color": "blue", "pct": 55.0 },
        { "label": "Unprioritised", "color": "muted", "pct": 15.0 }
      ],
      "ageMeta": [
        { "label": "0-3 wk", "color": "green", "pct": 70.0 },
        { "label": "3-6 wk", "color": "amber", "pct": 20.0 },
        { "label": "6-10 wk", "color": "purple", "pct": 10.0 },
        { "label": ">10 wk", "color": "red", "pct": 0.0 }
      ],
      "notes": []
    },
    {
      "id": "authOste",
      "name": "Auth OSTE",
      "domain": "SAP",
      "baseline": 15,
      "fte": 3,
      "total": 3,
      "inc": 2,
      "sr": 1,
      "resolved": 3,
      "netFlow": 0,
      "openCount": 0,
      "respSla": 100.0,
      "resolSla": 100.0,
      "mttr": 6.2,
      "reopenRate": 0.0,
      "firstFixRate": 100.0,
      "breachCount": 0,
      "nearMissCount": 0,
      "escalationRate": 0.0,
      "automation": 0,
      "mom": [4, 3, 4, 3, 3, 3],
      "incMom": [2, 2, 2, 2, 2, 2],
      "srMom": [2, 1, 2, 1, 1, 1],
      "resolvedMom": [4, 3, 4, 3, 3, 3],
      "netFlowMom": [0, 0, 0, 0, 0, 0],
      "backlogMom": [1, 0, 0, 0, 0, 0],
      "respSlaMom": [100.0, 100.0, 100.0, 100.0, 100.0, 100.0],
      "resolSlaMom": [100.0, 100.0, 100.0, 100.0, 100.0, 100.0],
      "priority": [0.0, 20.0, 60.0, 20.0],
      "age": [100.0, 0.0, 0.0, 0.0],
      "priorityMeta": [
        { "label": "P1/P2", "color": "red", "pct": 0.0 },
        { "label": "P3", "color": "amber", "pct": 20.0 },
        { "label": "P4", "color": "blue", "pct": 60.0 },
        { "label": "Unprioritised", "color": "muted", "pct": 20.0 }
      ],
      "ageMeta": [
        { "label": "0-3 wk", "color": "green", "pct": 100.0 },
        { "label": "3-6 wk", "color": "amber", "pct": 0.0 },
        { "label": "6-10 wk", "color": "purple", "pct": 0.0 },
        { "label": ">10 wk", "color": "red", "pct": 0.0 }
      ],
      "notes": [
        "- Clean run this period. No escalations or SLA issues."
      ]
    },
    {
      "id": "ficoOekg",
      "name": "FICO OEKG",
      "domain": "SAP",
      "baseline": 25,
      "fte": 4,
      "total": 6,
      "inc": 4,
      "sr": 2,
      "resolved": 5,
      "netFlow": 1,
      "openCount": 2,
      "respSla": 91.5,
      "resolSla": 94.3,
      "mttr": 22.6,
      "reopenRate": 10.5,
      "firstFixRate": 89.5,
      "breachCount": 2,
      "nearMissCount": 3,
      "escalationRate": 6.7,
      "automation": 0,
      "mom": [7, 7, 6, 6, 6, 6],
      "incMom": [5, 4, 4, 4, 4, 4],
      "srMom": [2, 3, 2, 2, 2, 2],
      "resolvedMom": [6, 5, 5, 5, 5, 5],
      "netFlowMom": [1, 2, 1, 1, 1, 1],
      "backlogMom": [3, 3, 3, 3, 2, 2],
      "respSlaMom": [92.0, 91.8, 92.5, 91.0, 92.2, 91.5],
      "resolSlaMom": [95.0, 94.5, 95.2, 93.8, 94.8, 94.3],
      "priority": [30.0, 40.0, 25.0, 5.0],
      "age": [35.0, 35.0, 20.0, 10.0],
      "priorityMeta": [
        { "label": "P1/P2", "color": "red", "pct": 30.0 },
        { "label": "P3", "color": "amber", "pct": 40.0 },
        { "label": "P4", "color": "blue", "pct": 25.0 },
        { "label": "Unprioritised", "color": "muted", "pct": 5.0 }
      ],
      "ageMeta": [
        { "label": "0-3 wk", "color": "green", "pct": 35.0 },
        { "label": "3-6 wk", "color": "amber", "pct": 35.0 },
        { "label": "6-10 wk", "color": "purple", "pct": 20.0 },
        { "label": ">10 wk", "color": "red", "pct": 10.0 }
      ],
      "notes": [
        "- Month-end closing activities driving higher P1/P2 volume and MTTR.",
        "- Two SLA breaches in P2 tickets resolved outside target."
      ]
    },
    {
      "id": "ficoOste",
      "name": "FICO OSTE",
      "domain": "SAP",
      "baseline": 18,
      "fte": 3,
      "total": 4,
      "inc": 2,
      "sr": 2,
      "resolved": 4,
      "netFlow": 0,
      "openCount": 1,
      "respSla": 96.0,
      "resolSla": 97.5,
      "mttr": 14.8,
      "reopenRate": 5.0,
      "firstFixRate": 95.0,
      "breachCount": 0,
      "nearMissCount": 1,
      "escalationRate": 2.5,
      "automation": 0,
      "mom": [5, 4, 5, 4, 4, 4],
      "incMom": [3, 2, 3, 2, 2, 2],
      "srMom": [2, 2, 2, 2, 2, 2],
      "resolvedMom": [4, 4, 4, 4, 4, 4],
      "netFlowMom": [1, 0, 1, 0, 0, 0],
      "backlogMom": [2, 1, 1, 1, 1, 1],
      "respSlaMom": [95.5, 96.0, 95.8, 96.5, 96.2, 96.0],
      "resolSlaMom": [97.0, 97.5, 97.2, 97.8, 97.6, 97.5],
      "priority": [15.0, 30.0, 45.0, 10.0],
      "age": [55.0, 30.0, 10.0, 5.0],
      "priorityMeta": [